{
  "asset_id": "asset7_constitution",
  "asset_name": "运气与体质交叉分析数据库",
  "asset_description": "九种体质（王琦九分法）与五运六气格局的匹配关系。不同出生年运气格局影响先天体质倾向，不同运气岁气背景下各体质的发病倾向与调理要点。",
  "data_source": "王琦《中医体质学》九种体质分类 + 五运六气体质相关性研究文献 + 《素问·异法方宜论》《灵枢·阴阳二十五人》",
  "entry_count": 108,
  "entries": [
    {
      "entry_id": "constitution_1",
      "entry_type": "birth_yunqi_mapping",
      "constitution_name": "气虚质",
      "rag_key": "qi_xu_constitution",
      "constitution_code": "qi_xu",
      "birth_yunqi_keys": [
        "earth_deficient",
        "metal_excess"
      ],
      "description": "肺脾气虚，气短乏力，语声低怯，易出汗，易疲劳。",
      "typical_features": [
        "形体偏胖或消瘦，肌肉松软不实",
        "面色萎黄或淡白，容易疲乏",
        "气短懒言，语音低怯",
        "易出虚汗，活动后尤甚",
        "精神不振，健忘",
        "食欲不振，大便偏软"
      ],
      "birth_year_analysis": "气虚质的核心病机在于肺脾气虚，宗气与中气不足。出生年运气格局中，土运不及之岁（己年：己巳、己卯、己丑、己亥、己酉、己未），中运为少宫，土气衰微。土应脾胃，主运化水谷精微，土运不及则后天之本薄弱，脾不升清、胃不降浊，水谷精微输布障碍，形成气虚倾向。此类人群先天脾胃运化功能偏弱，水谷之气无以化生，故自幼食量偏小、肌肉不丰。金运太过之岁（庚年：庚午、庚辰、庚寅、庚子、庚戌、庚申），中运为太商，金气偏盛。金应肺，主气司呼吸，金气过亢则乘伐木气，而木为少阳春升之气，木气被郁则少阳生发之气受抑，影响全身气机升降。金气过盛反侮火，火为少火，少火生气，火气受抑则元气化生不足。金运太过之年出生者肺气易壅滞，肃降太过而宣发不足，表现为气短、卫外不固、易外感。综合来看，土运不及与金运太过均直接削弱人体气的生成与运行机制，前者因脾虚而化源不足，后者因肺郁而布散不利，两者皆可导致气虚倾向的形成。",
      "current_year_sensitivity": {
        "beneficial_yunqi": [
          "土运平气年",
          "火运太过年",
          "少火相火司天年"
        ],
        "adverse_yunqi": [
          "土运不及年",
          "金运太过年",
          "厥阴风木司天年"
        ],
        "explanation": "土运平气或火运太过之年，火能生土，有助于健脾益气，故气虚质者在此类年份体力较佳、少病。土运不及之年，中运与体质先天之虚相合，加重脾虚气弱。金运太过之年肺气易郁，气虚质者卫外功能更差，易反复感冒。厥阴风木司天之年，风气偏盛，木旺克土，脾胃受制，运化进一步减弱。"
      },
      "health_risks": [
        "反复上呼吸道感染",
        "慢性疲劳综合征",
        "内脏下垂（胃下垂、肾下垂）",
        "慢性胃炎、消化不良",
        "低血压、贫血",
        "重症肌无力倾向"
      ],
      "lifestyle_advice": "气虚质者宜静养为主，劳逸结合。避免剧烈运动及大汗淋漓，以防气随汗泄。宜选择太极拳、八段锦、散步等柔和运动，逐渐增加运动量。保证充足睡眠，避免熬夜伤气。注意保暖，尤以腹部、背部为要。情绪上宜保持稳定，避免过度思虑，因思则气结、劳则气耗。",
      "dietary_guidance": "宜食益气健脾之品，如黄芪、党参、山药、白扁豆、大枣、莲子、糯米、小米、鸡肉、牛肉、鲫鱼等。药膳推荐：黄芪炖鸡汤、参苓粥、山药排骨汤。忌食生冷寒凉、耗气破气之物，如萝卜（生食）、浓茶、槟榔、苦瓜、荞麦等。饮食宜温热软烂，细嚼慢咽。",
      "herbal_reference": "主方：四君子汤、补中益气汤、玉屏风散。气虚甚者加黄芪、党参；气虚兼湿者用参苓白术散；卫气不固者重用黄芪、白术、防风。常用药对：黄芪配党参、白术配茯苓、升麻配柴胡。忌大量使用行气破气药如枳实、厚朴、青皮等。",
      "source": "王琦《中医体质学》+ 五运六气体质学"
    },
    {
      "entry_id": "constitution_2",
      "entry_type": "birth_yunqi_mapping",
      "constitution_name": "阳虚质",
      "rag_key": "yang_xu_constitution",
      "constitution_code": "yang_xu",
      "birth_yunqi_keys": [
        "water_excess",
        "fire_deficient"
      ],
      "description": "阳气不足，畏寒怕冷，手足不温，喜热饮食，精神不振。",
      "typical_features": [
        "形体白胖，肌肉松软",
        "畏寒怕冷，四肢不温",
        "喜热饮热食，不耐寒凉",
        "精神不振，睡眠偏多",
        "口唇色淡，舌淡胖嫩",
        "小便清长，大便溏薄"
      ],
      "birth_year_analysis": "阳虚质之根本在于阳气衰微，温煦失职。水运太过之岁（丙年：丙寅、丙子、丙戌、丙午、丙辰、丙申），中运为太羽，水气流行。水为至阴，其气寒凝。水运太过则寒水之气偏盛，直折心火。心为阳中之太阳，主血脉而藏神明，心火被寒水所遏则心阳不振，血脉运行迟滞。且水盛乘火，火气受制则不能温煦全身，故先天阳气宣发不足。肾阳为人身阳气之根本，水运太过之年寒水之气通于肾，肾阳被寒所遏则命门火衰，温煦失职。火运不及之岁（癸年：癸酉、癸未、癸巳、癸卯、癸丑、癸亥），中运为少徵，火气衰微。火为少火，少火生气亦生阳。火运不及则阳气化生之源匮乏，先天即处于阳气不足的状态。火衰不能暖土，土寒则运化失司，故阳虚质者常兼脾胃虚寒。两类年份均指向阳气不足：水运太过为寒水抑阳，火运不及为化阳无源，殊途而同归，皆形成阳虚质倾向。",
      "current_year_sensitivity": {
        "beneficial_yunqi": [
          "火运太过年",
          "土运太过年",
          "少阴君火司天年",
          "少阳相火司天年"
        ],
        "adverse_yunqi": [
          "水运太过年",
          "火运不及年",
          "太阳寒水司天年"
        ],
        "explanation": "火运太过及君火、相火司天之年，天地阳气充盛，有助于温养阳虚之体，是阳虚质者较舒适的年份。土运太过之年，土能制水，且土为火之子，火气得以伸张，亦为有利。水运太过或太阳寒水司天之年，寒水之气猖獗，内外合邪，阳气得损，易发寒性疾病。火运不及之年，先天阳气基础薄弱者更觉不支。"
      },
      "health_risks": [
        "慢性腹泻、五更泻",
        "阳痿、宫寒不孕",
        "风湿痹痛、寒性关节痛",
        "慢性支气管炎、哮喘（寒哮）",
        "甲状腺功能减退",
        "慢性心力衰竭倾向"
      ],
      "lifestyle_advice": "阳虚质者当以温补阳气为要务。居住环境宜向阳、温暖干燥。运动宜在日光充足之时进行，以升发阳气，如慢跑、步行、太极拳等，但不宜过量出汗。注意保暖，尤其腰背、腹部、膝部及足部，不可贪凉露宿。可经常艾灸关元、气海、足三里、命门等穴。节制房事，保护肾阳。冬季宜早卧晚起，以待日光。",
      "dietary_guidance": "宜食温阳益火之品，如羊肉、狗肉、鹿肉、核桃、韭菜、肉桂、干姜、小茴香、花椒、丁香等。药膳推荐：当归生姜羊肉汤、肉桂炖猪肚、附子炖狗肉。忌食生冷寒凉之品，如冰镇饮料、西瓜、梨、苦瓜、黄瓜、螃蟹等。烹饪中可适当加入生姜、胡椒等温性调料。",
      "herbal_reference": "主方：金匮肾气丸、右归丸、理中丸。阳虚兼气虚者用保元汤；脾肾阳虚者用附子理中汤；心阳虚者用桂枝甘草汤加味。常用药对：附子配干姜、肉桂配杜仲、鹿角胶配龟板胶。注意：附子须先煎久煎以去毒性；温阳药忌大量用于阴虚火旺者。",
      "source": "王琦《中医体质学》+ 五运六气体质学"
    },
    {
      "entry_id": "constitution_3",
      "entry_type": "birth_yunqi_mapping",
      "constitution_name": "阴虚质",
      "rag_key": "yin_xu_constitution",
      "constitution_code": "yin_xu",
      "birth_yunqi_keys": [
        "fire_excess",
        "dryness_excess"
      ],
      "description": "阴液亏少，口干咽燥，手足心热，喜冷饮，大便干结。",
      "typical_features": [
        "形体偏瘦，面色潮红",
        "口燥咽干，喜冷饮",
        "手足心热，潮热盗汗",
        "大便干结，小便短黄",
        "舌红少苔或无苔",
        "性情急躁，易有失眠"
      ],
      "birth_year_analysis": "阴虚质乃阴液亏损、虚热内扰之体。火运太过之岁（戊年：戊辰、戊寅、戊子、戊戌、戊申、戊午），中运为太徵，火气炎上。火运太过则壮火食气，燔灼阴液。心火亢盛则下汲肾水，肾阴被耗；肺金受火刑则清肃不行，津液不布；胃火炽盛则消谷善饥而阴液暗耗。太过之火不仅耗伤当前之阴，更可通过胎孕时期的影响，使先天阴精禀赋不足。阳明燥金司天之年（卯酉年：卯酉为阳明司天），燥气偏盛。燥为次寒，其性干涩，易伤津液。肺为娇脏，喜润恶燥，燥气通于肺，肺津被灼则宣降失常。阳明燥金之气偏盛，金从燥化，其气敛降太过，天气肃杀，地气干燥。胎孕时期感受燥气，则先天肺阴不足，皮肤毛发失于濡润。且燥胜则干，津液枯涸，肠道失润则大便干结。火太过与燥气盛皆能伤阴，前者以灼烁阴液为主，后者以劫夺津液为要，两因叠加则阴虚质之倾向更加显著。",
      "current_year_sensitivity": {
        "beneficial_yunqi": [
          "水运太过年",
          "金运平气年",
          "太阴湿土司天年"
        ],
        "adverse_yunqi": [
          "火运太过年",
          "阳明燥金司天年",
          "少阳相火司天年"
        ],
        "explanation": "水运太过之年，水能制火且水主藏精，有助于滋养阴液，阴虚质者得水气之助而自觉舒适。金运平气之年，金水相生，亦有利于滋阴润燥。太阴湿土司天之年，湿气偏盛，能润燥，可缓解干燥症状。火运太过之年，火上浇油，阴虚质者易发虚火亢盛诸症。阳明燥金司天之年，燥气加临，内外合邪，口干便秘等症加剧。"
      },
      "health_risks": [
        "2型糖尿病倾向",
        "甲状腺功能亢进",
        "干燥综合征",
        "习惯性便秘",
        "高血压（阴虚阳亢型）",
        "失眠症、焦虑症"
      ],
      "lifestyle_advice": "阴虚质者宜静养以藏阴。居住环境宜安静、湿润，避免燥热环境。运动宜选择低强度、不令大汗者，如瑜伽、游泳、太极拳、步行等。保证充足睡眠，尤其子午觉（午时小憩、子时前入睡），以利于阴液潜藏。节制房事以保阴精。情绪上宜避免急躁、发怒，怒则伤阴、火更旺。可练习静坐、冥想以安神定志。",
      "dietary_guidance": "宜食滋阴润燥之品，如百合、银耳、雪梨、甘蔗、荸荠、莲藕、山药、枸杞、黑芝麻、鸭肉、甲鱼、龟肉、海参等。药膳推荐：百合银耳羹、枸杞甲鱼汤、沙参玉竹炖老鸭。忌食辛辣燥热之品，如辣椒、花椒、葱蒜、羊肉、狗肉等。忌烟酒、咖啡、浓茶等耗阴之品。",
      "herbal_reference": "主方：六味地黄丸、知柏地黄丸、大补阴丸、天王补心丹。肺阴虚者用沙参麦冬汤；胃阴虚者用益胃汤；肝阴虚者用一贯煎；心阴虚者用天王补心丹。常用药对：生地黄配麦冬、沙参配玉竹、枸杞配女贞子、旱莲草配龟板。注意滋阴药多滋腻，脾胃虚弱者需配伍砂仁、陈皮等醒脾之品。",
      "source": "王琦《中医体质学》+ 五运六气体质学"
    },
    {
      "entry_id": "constitution_4",
      "entry_type": "birth_yunqi_mapping",
      "constitution_name": "痰湿质",
      "rag_key": "tan_shi_constitution",
      "constitution_code": "tan_shi",
      "birth_yunqi_keys": [
        "earth_excess",
        "taiyin_dampness_sitian"
      ],
      "description": "痰湿凝聚，形体肥胖，腹部肥满松软，口黏苔腻。",
      "typical_features": [
        "形体肥胖，腹部肥满松软",
        "面部皮肤油脂较多",
        "多汗且黏，胸闷痰多",
        "口黏腻或甜，舌苔白腻",
        "身重不爽，容易困倦",
        "大便不成形或黏滞不爽"
      ],
      "birth_year_analysis": "痰湿质乃水液代谢失常、痰湿内停之体。土运太过之岁（甲年：甲子、甲戌、甲申、甲午、甲辰、甲寅），中运为太宫，土气敦阜。土应脾胃，主运化水湿。土运太过则脾实而运化太过？实则不然——土气太过则壅塞满闷，反而导致升降失司。土气过亢则湿气内生，脾胃虽旺于运化，但湿气不化，反而停聚成痰。且土旺克水，水被土壅则水道不利，水湿停聚更甚。土运太过之年，又兼太阳寒水或少阳相火等司天在泉，寒湿或湿热交蒸，亦可生痰。太阴湿土司天之年（丑未年：丑未为太阴司天），湿气偏盛。太阴湿土之气弥漫天地，湿为阴邪，重浊黏滞，易困阻脾阳。脾喜燥而恶湿，湿气困脾则运化失职，水谷精微不归正化，化为痰湿。胎孕时期若逢丑未湿土司天之年，感受湿气偏盛之气，则先天脾阳容易被湿所困，形成痰湿质倾向。土运太过以土实壅滞为主因，太阴司天以湿困脾阳为主因，两者皆导致水湿停聚、痰浊内生。",
      "current_year_sensitivity": {
        "beneficial_yunqi": [
          "木运太过年",
          "少阳相火司天年",
          "阳明燥金司天年"
        ],
        "adverse_yunqi": [
          "土运太过年",
          "太阴湿土司天年",
          "水运太过年"
        ],
        "explanation": "木运太过之年，木能疏土，有助于运化水湿，故痰湿质者在此类年份身体较为轻松。少阳相火司天之年，火能燥湿，亦为有利。阳明燥金司天之年，燥可胜湿。土运太过与太阴湿土司天之年，内外湿邪相合，痰湿质者症状加重。水运太过之年，寒水泛滥，水湿更盛，亦非所宜。"
      },
      "health_risks": [
        "肥胖症、代谢综合征",
        "高脂血症、脂肪肝",
        "睡眠呼吸暂停综合征",
        "2型糖尿病（痰湿型）",
        "冠心病、脑卒中",
        "多囊卵巢综合征"
      ],
      "lifestyle_advice": "痰湿质者当以化痰利湿为原则，宜增加运动量以助气化水湿。坚持有氧运动，如长跑、游泳、快走、球类运动等，以微微汗出为度。居住环境宜干燥通风，避免潮湿。衣着宜透气吸汗。情绪上宜保持积极乐观，避免久坐久卧、思虑过度。可温水泡脚促进气血循环。",
      "dietary_guidance": "宜食健脾化痰利湿之品，如薏苡仁、茯苓、白扁豆、赤小豆、冬瓜、萝卜、陈皮、山楂、荷叶、海带、紫菜等。药膳推荐：薏苡仁赤小豆汤、陈皮普洱茶、茯苓山药粥。忌食肥甘厚味、甜腻生痰之品，如肥肉、奶油、糖果、巧克力、油炸食品等。少饮酒类及含糖饮料。",
      "herbal_reference": "主方：二陈汤、平胃散、温胆汤、参苓白术散。痰湿较重者用导痰汤；痰湿化热者用黄连温胆汤；脾虚痰湿者用香砂六君子汤。常用药对：陈皮配半夏、苍术配厚朴、茯苓配泽泻、荷叶配山楂。注意：燥湿化痰药久服易伤阴，需配伍养阴之品。",
      "source": "王琦《中医体质学》+ 五运六气体质学"
    },
    {
      "entry_id": "constitution_5",
      "entry_type": "birth_yunqi_mapping",
      "constitution_name": "湿热质",
      "rag_key": "shi_re_constitution",
      "constitution_code": "shi_re",
      "birth_yunqi_keys": [
        "fire_earth_combined",
        "shaoyang_xianghuo_sitian"
      ],
      "description": "湿热内蕴，面垢油光，易生痤疮，口苦口干，身重困倦。",
      "typical_features": [
        "面垢油光，易生痤疮粉刺",
        "口苦口干，口臭",
        "身重困倦，大便黏滞不爽",
        "小便短黄，女性带下色黄",
        "男性阴囊潮湿",
        "舌红苔黄腻"
      ],
      "birth_year_analysis": "湿热质乃湿热交蒸、郁于体内所致。火土组合之年，即同时具有火运与土运偏盛特征的年份，火能生土，土得火助则湿从热化。火为热之极，土为湿之本，湿热相合如油入面，胶着难解。火运之岁热势偏盛，土运之岁湿气偏盛，两运叠加则湿热互结。少阳相火司天之年（寅申年：寅申为少阳司天），相火之气行令。相火者，龙雷之火也，其性炎上而善行数变。少阳相火司天之年，天时温热偏盛，火气蒸腾。若在泉为厥阴风木，风火相煽，湿热更易弥漫。且相火之下，水气承之，水火交争则湿热氤氲。胎孕时期感受火湿交蒸之气，先天即处于湿热体质状态。此类人群禀火之炎上与湿之重浊，故既具热象（面垢油光、痤疮、口苦），又有湿象（身重困倦、大便黏滞），形成典型的湿热质表现。",
      "current_year_sensitivity": {
        "beneficial_yunqi": [
          "水运太过年",
          "金运太过年",
          "阳明燥金司天年"
        ],
        "adverse_yunqi": [
          "火运太过年",
          "土运太过年",
          "少阳相火司天年",
          "太阴湿土司天年"
        ],
        "explanation": "水运太过之年，寒水之气能清热燥湿，有助于湿热质者清利湿热。金运太过之年，金主燥降，燥胜湿，亦为有利。阳明燥金司天之年，燥气偏盛，能化湿清热。相反，火运太过与土运太过之年，热与湿更盛，症状加重。少阳相火司天与太阴湿土司天之年，湿热内外合邪，发病风险增高。"
      },
      "health_risks": [
        "痤疮、湿疹、脂溢性皮炎",
        "慢性肝炎、胆囊炎",
        "泌尿系感染",
        "阴道炎、前列腺炎",
        "痛风、高尿酸血症",
        "代谢综合征"
      ],
      "lifestyle_advice": "湿热质者宜清利湿热，保持二便通畅。居住环境宜凉爽干燥，避免闷热潮湿环境。运动宜选中等以上强度，如快跑、球类运动、游泳等，运动出汗有助于湿邪排出，但运动后应及时擦干并更换衣物。避免熬夜，熬夜易生湿热。情绪宜平和，避免恼怒，怒则火更旺。戒烟限酒，尤其减少啤酒、白酒摄入。",
      "dietary_guidance": "宜食清热利湿之品，如绿豆、赤小豆、薏苡仁、冬瓜、丝瓜、苦瓜、黄瓜、芹菜、马齿苋、蒲公英、绿茶等。药膳推荐：薏苡仁绿豆汤、冬瓜薏米排骨汤、茵陈红枣茶。忌食辛辣燥热、肥甘厚味之品，如辣椒、烧烤、油炸、羊肉、狗肉、海鲜发物等。少食甜腻之品以防助湿生热。",
      "herbal_reference": "主方：甘露消毒丹、龙胆泻肝汤、半夏泻心汤、茵陈蒿汤。湿热在上焦者用三仁汤；中焦湿热者用连朴饮；下焦湿热者用八正散。常用药对：茵陈配栀子、龙胆草配黄芩、滑石配甘草、黄柏配苍术。注意：苦寒清热药久服伤胃，需中病即止或配伍顾护胃气之品。",
      "source": "王琦《中医体质学》+ 五运六气体质学"
    },
    {
      "entry_id": "constitution_6",